{
  "citation_id": "cit_01jq7bwpt6mjjd7c9wqgt28v87",
  "source_document_id": "doc_01jq7bdptzqv3xs0c41xpw1ybg",
  "source_section_id": "sec_01jq7bprm7p1ef4rwr7s2j1bt3",
  "target_document_id": "doc_01jq7byw0gsj3x17kdpe2vsk2n",
  "citation_text": "vgl. Art. 5 BV",
  "normalized_reference": "BV Art. 5",
  "citation_type": "statute_reference",
  "resolved": true,
  "metadata": {
    "confidence": 0.93
  }
}
